{
  "schemaVersion": 1,
  "artifactType": "psfn.repeng_reader_result",
  "createdAt": "2026-01-01T00:00:00.000Z",
  "controlVectorManifest": {
    "path": "fixture",
    "sha256": "0000000000000000000000000000000000000000000000000000000000000000",
    "artifactId": "fixture-reader",
    "datasetId": "fixture",
    "trainingBackend": "fixture",
    "modelId": "moonshotai/kimi-k2.5",
    "layers": [
      0,
      1
    ],
    "axisIds": [
      "acac.control.high_vs_low"
    ]
  },
  "reader": {
    "backend": "fixture",
    "projectionPool": "mean",
    "targetLayers": [
      0,
      1
    ],
    "logitLensTopK": 2
  },
  "scenarioCount": 3,
  "scenarios": [],
  "projections": [
    {
      "scenarioId": "cal-001",
      "axisId": "acac.control.high_vs_low",
      "layer": 0,
      "projection": 0.1,
      "hiddenNorm": 1,
      "vectorNorm": 1,
      "expectedScore": -1,
      "alignment": -0.1
    },
    {
      "scenarioId": "cal-001",
      "axisId": "acac.control.high_vs_low",
      "layer": 1,
      "projection": -0.8,
      "hiddenNorm": 1,
      "vectorNorm": 1,
      "expectedScore": -1,
      "alignment": 0.8
    },
    {
      "scenarioId": "cal-002",
      "axisId": "acac.control.high_vs_low",
      "layer": 1,
      "projection": -0.4,
      "hiddenNorm": 1,
      "vectorNorm": 1,
      "expectedScore": -1,
      "alignment": 0.4
    },
    {
      "scenarioId": "cal-003",
      "axisId": "acac.control.high_vs_low",
      "layer": 1,
      "projection": 0.4,
      "hiddenNorm": 1,
      "vectorNorm": 1,
      "expectedScore": 1,
      "alignment": 0.4
    }
  ],
  "logitLens": [],
  "layerSummaries": [
    {
      "layer": 1,
      "evidenceCount": 3,
      "meanExpectedAlignment": 0.5333333333,
      "signAccuracy": 1,
      "pearsonCorrelation": 1
    }
  ],
  "honestLayer": {
    "layer": 1,
    "selectionMetric": "sign_accuracy_then_mean_expected_alignment",
    "evidenceCount": 3,
    "signAccuracy": 1,
    "meanExpectedAlignment": 0.5333333333,
    "pearsonCorrelation": 1
  }
}
